{
  "schema_version": "SourceManifest.v1",
  "manifest_id": "exam-checker-sources-v1",
  "created_at": "2026-08-05T03:45:38.664511Z",
  "workspace_root": "D:\\hyt-agent",
  "snapshot_ref": {
    "snapshot_id": "training-data-v1",
    "snapshot_root": "D:\\hyt-agent\\数据资产\\raw_snapshot\\v1",
    "content_set_sha256": "4c03cefc16ebe7f45380ceecdac23b4154b8e420bf273e661acecf4ca28875a8"
  },
  "sources": [
    {
      "source_id": "src_f71d5ac6692577c7e40cbe42",
      "dataset_variant": "original_prompts",
      "source_type": "historical",
      "snapshot_relative_path": "训练集/标点符号错误_训练集.jsonl",
      "sha256": "9667cf37c989b9b91433ed3498353df3df4f355033a2f5e7d12de167230a392f",
      "size_bytes": 12162701,
      "authorization_status": "not_recorded",
      "sensitivity_status": "not_assessed",
      "jsonl_rows": 1061
    },
    {
      "source_id": "src_d87f79a8ef20806a1eda7697",
      "dataset_variant": "original_prompts",
      "source_type": "historical",
      "snapshot_relative_path": "训练集/错别字_训练集.jsonl",
      "sha256": "6341c71893afd53414c67bb32b80bee0d5d63a61751ab6233440dd1ba7000db8",
      "size_bytes": 10185304,
      "authorization_status": "not_recorded",
      "sensitivity_status": "not_assessed",
      "jsonl_rows": 989
    },
    {
      "source_id": "src_927a73b5c47bc34bc15a9e42",
      "dataset_variant": "original_prompts",
      "source_type": "historical",
      "snapshot_relative_path": "训练集/答案泄露_训练集.jsonl",
      "sha256": "456a65ab535deaa7d01a8168ecdb918bdd947a7e39868689dee960c7f1c3858c",
      "size_bytes": 2705098,
      "authorization_status": "not_recorded",
      "sensitivity_status": "not_assessed",
      "jsonl_rows": 182
    },
    {
      "source_id": "src_5ed563625184ca73c2595b58",
      "dataset_variant": "original_prompts",
      "source_type": "historical",
      "snapshot_relative_path": "训练集/德语_训练集.jsonl",
      "sha256": "affa6e2c39e54d0b9475460581265522a128da38907d460e499a8b9cc5e4fbcf",
      "size_bytes": 11623598,
      "authorization_status": "not_recorded",
      "sensitivity_status": "not_assessed",
      "jsonl_rows": 672
    },
    {
      "source_id": "src_7eb2461541260dacafddced0",
      "dataset_variant": "original_prompts",
      "source_type": "historical",
      "snapshot_relative_path": "训练集/法语_训练集.jsonl",
      "sha256": "b7cf749237a303cb0056cc7651bdb390e5cb6f593f74c4349dce93183d087249",
      "size_bytes": 7590368,
      "authorization_status": "not_recorded",
      "sensitivity_status": "not_assessed",
      "jsonl_rows": 477
    },
    {
      "source_id": "src_8a914544b5a9b6f9bf6b90f2",
      "dataset_variant": "original_prompts",
      "source_type": "historical",
      "snapshot_relative_path": "训练集/日语_训练集.jsonl",
      "sha256": "da5893e899032390f7a0f920d675529ec5c27a5daa9acc6fe566b0fd2bf73ca0",
      "size_bytes": 20424157,
      "authorization_status": "not_recorded",
      "sensitivity_status": "not_assessed",
      "jsonl_rows": 1432
    },
    {
      "source_id": "src_b3cfd8e0fd05ba28cb98e47a",
      "dataset_variant": "original_prompts",
      "source_type": "historical",
      "snapshot_relative_path": "训练集/题目无解_训练集.jsonl",
      "sha256": "21b429bbd48e23ff474e42cc874f0013dc36c9f2b9999172887fb231f5753970",
      "size_bytes": 31747871,
      "authorization_status": "not_recorded",
      "sensitivity_status": "not_assessed",
      "jsonl_rows": 1093
    },
    {
      "source_id": "src_cdfd6c7f5574446523e6d86a",
      "dataset_variant": "original_prompts",
      "source_type": "historical",
      "snapshot_relative_path": "训练集/题目与题型不一致_训练集.jsonl",
      "sha256": "74c5958386fb738748bc320c4ae7427b8f50eff7744d50177274924d6e886ba7",
      "size_bytes": 6889507,
      "authorization_status": "not_recorded",
      "sensitivity_status": "not_assessed",
      "jsonl_rows": 910
    },
    {
      "source_id": "src_6ba7f4aa369875eee5bda64f",
      "dataset_variant": "original_prompts",
      "source_type": "historical",
      "snapshot_relative_path": "训练集/信息缺失_训练集.jsonl",
      "sha256": "a56b3d5f97dc2ef0fe1f3ca519fa2e80b8722dfd12fefd328611de050794b61a",
      "size_bytes": 9549604,
      "authorization_status": "not_recorded",
      "sensitivity_status": "not_assessed",
      "jsonl_rows": 479
    },
    {
      "source_id": "src_1922b99d234b08b95d731bb4",
      "dataset_variant": "original_prompts",
      "source_type": "historical",
      "snapshot_relative_path": "训练集/选项结构错误_训练集.jsonl",
      "sha256": "c24ad33b67227815e8cd6369dad164387eeada0588910d295a91f00e8104a7fe",
      "size_bytes": 7830373,
      "authorization_status": "not_recorded",
      "sensitivity_status": "not_assessed",
      "jsonl_rows": 980
    },
    {
      "source_id": "src_776a0161f7f86fe543292c23",
      "dataset_variant": "original_prompts",
      "source_type": "historical",
      "snapshot_relative_path": "训练集/英语_训练集.jsonl",
      "sha256": "5c9dd05132b7d6ad2824e857f97d2c272f50227a520e66fe5f00726d7a1df43e",
      "size_bytes": 11463826,
      "authorization_status": "not_recorded",
      "sensitivity_status": "not_assessed",
      "jsonl_rows": 615
    },
    {
      "source_id": "src_48eacc22380948ffbae43763",
      "dataset_variant": "original_prompts",
      "source_type": "historical",
      "snapshot_relative_path": "训练集/语义不清_训练集.jsonl",
      "sha256": "f09423b5ec9d521a38f49eab9d9995eaa46c75176dae54391067619d93006a35",
      "size_bytes": 27513304,
      "authorization_status": "not_recorded",
      "sensitivity_status": "not_assessed",
      "jsonl_rows": 910
    },
    {
      "source_id": "src_33ccb2b47f531d2db7457c6d",
      "dataset_variant": "tuned_prompts",
      "source_type": "derived_prompt_render",
      "snapshot_relative_path": "训练集-微调版提示词/标点符号错误_训练集.jsonl",
      "sha256": "04ba1f8e03f5080245f5e1f707cb39e47e8f2b34db32d77e857fc3dabd55c025",
      "size_bytes": 4160639,
      "authorization_status": "not_recorded",
      "sensitivity_status": "not_assessed",
      "jsonl_rows": 1061,
      "parent_source_id": "src_f71d5ac6692577c7e40cbe42"
    },
    {
      "source_id": "src_0b24b9391e52b63d57d35e95",
      "dataset_variant": "tuned_prompts",
      "source_type": "derived_prompt_render",
      "snapshot_relative_path": "训练集-微调版提示词/错别字_训练集.jsonl",
      "sha256": "a9a2cac302b610277c00079a4026170ab13691a878590f570d797617357326d3",
      "size_bytes": 3757793,
      "authorization_status": "not_recorded",
      "sensitivity_status": "not_assessed",
      "jsonl_rows": 989,
      "parent_source_id": "src_d87f79a8ef20806a1eda7697"
    },
    {
      "source_id": "src_6bb7a7963220bd97dc5f7c5d",
      "dataset_variant": "tuned_prompts",
      "source_type": "derived_prompt_render",
      "snapshot_relative_path": "训练集-微调版提示词/答案泄露_训练集.jsonl",
      "sha256": "60d9f27dacad9567c71c739fffa3a2cb059c6bbc46ea0d41c69db34ca69a5251",
      "size_bytes": 770074,
      "authorization_status": "not_recorded",
      "sensitivity_status": "not_assessed",
      "jsonl_rows": 182,
      "parent_source_id": "src_927a73b5c47bc34bc15a9e42"
    },
    {
      "source_id": "src_d016c72b45ae560268866d13",
      "dataset_variant": "tuned_prompts",
      "source_type": "derived_prompt_render",
      "snapshot_relative_path": "训练集-微调版提示词/德语_训练集.jsonl",
      "sha256": "560f962a9d3f57f3232de12fa92018df5e4d6caee271b7b8ddd88d6350019ee0",
      "size_bytes": 2516430,
      "authorization_status": "not_recorded",
      "sensitivity_status": "not_assessed",
      "jsonl_rows": 672,
      "parent_source_id": "src_5ed563625184ca73c2595b58"
    },
    {
      "source_id": "src_133a8278a7232598779f7532",
      "dataset_variant": "tuned_prompts",
      "source_type": "derived_prompt_render",
      "snapshot_relative_path": "训练集-微调版提示词/法语_训练集.jsonl",
      "sha256": "a1b4493e884dbca0f23f459b6e800f2749889284f875c8ac90fc4e6c4d061676",
      "size_bytes": 1675409,
      "authorization_status": "not_recorded",
      "sensitivity_status": "not_assessed",
      "jsonl_rows": 477,
      "parent_source_id": "src_7eb2461541260dacafddced0"
    },
    {
      "source_id": "src_5f9d6d4fb5e3d8e98b4224d1",
      "dataset_variant": "tuned_prompts",
      "source_type": "derived_prompt_render",
      "snapshot_relative_path": "训练集-微调版提示词/日语_训练集.jsonl",
      "sha256": "5f7b0b6c235633f141d8621eee8e6eb6053b754c97150958eaf74fd03e6607d5",
      "size_bytes": 5530283,
      "authorization_status": "not_recorded",
      "sensitivity_status": "not_assessed",
      "jsonl_rows": 1432,
      "parent_source_id": "src_8a914544b5a9b6f9bf6b90f2"
    },
    {
      "source_id": "src_f09b1b5d7c2c17310ba22cd8",
      "dataset_variant": "tuned_prompts",
      "source_type": "derived_prompt_render",
      "snapshot_relative_path": "训练集-微调版提示词/题目无解_训练集.jsonl",
      "sha256": "9d6678e4bcbd8488c8c7cce6b9821674a001c18e7e7582c645c1643e51338c4a",
      "size_bytes": 6032860,
      "authorization_status": "not_recorded",
      "sensitivity_status": "not_assessed",
      "jsonl_rows": 1093,
      "parent_source_id": "src_b3cfd8e0fd05ba28cb98e47a"
    },
    {
      "source_id": "src_7f3130a2873ae8fe3e2d7392",
      "dataset_variant": "tuned_prompts",
      "source_type": "derived_prompt_render",
      "snapshot_relative_path": "训练集-微调版提示词/题目与题型不一致_训练集.jsonl",
      "sha256": "b51e76ade8f99eb84b97239cb205f866884a3be5f176841b6197b55a7a8d103c",
      "size_bytes": 3860117,
      "authorization_status": "not_recorded",
      "sensitivity_status": "not_assessed",
      "jsonl_rows": 910,
      "parent_source_id": "src_cdfd6c7f5574446523e6d86a"
    },
    {
      "source_id": "src_98abb086805ec703d78e7032",
      "dataset_variant": "tuned_prompts",
      "source_type": "generation_manifest",
      "snapshot_relative_path": "训练集-微调版提示词/微调版提示词测试集清单.json",
      "sha256": "6286a2332aa6a9126bd6ef04325a9be5eaeb9d09b5294b87d8bfbdc43751f54e",
      "size_bytes": 9032,
      "authorization_status": "not_recorded",
      "sensitivity_status": "not_assessed"
    },
    {
      "source_id": "src_755881509f70025c1df7a605",